{
  "condition_schema_version": "3.0.0",
  "music_asset_id": "local_asset_example_001",
  "model_bundle_id": "example_bundle_untrained_DO_NOT_USE",
  "difficulty_class": "EZ",
  "difficulty_value": 8,
  "chart_mode": "pure_keys",
  "key_count": 4,
  "performance_intensity": 0,
  "performance_style": "none",
  "wildness": 25,
  "generation_priority": "playability",
  "special_features": [],
  "strict_playability": true,
  "seed": 42,
  "target_duration": "full_song",
  "target_engine": "phira",
  "target_engine_version": "0.8.2"
}
